keys,en,ja,ru,fr,es,de,pt,it,ko,zh
FETCHING_CONFIG,Fetching config...,設定を取得中...,Получение конфигурации...,Récupération de la configuration...,Obteniendo configuración...,Konfiguration wird abgerufen...,Buscando configuração...,Recuperando configurazione...,설정을 가져오는 중...,获取配置中...
EXTRACTING,Extracting...,展開中...,Распаковка...,Extraction en cours...,Extrayendo...,Extrahieren...,Extraindo...,Estrazione...,추출 중...,提取中...
FAILED_FETCH_CONFIG,Failed to fetch the configuration.,設定の取得に失敗しました。,Не удалось получить конфигурацию.,Échec de la récupération de la configuration.,Error al obtener la configuración.,Konfiguration konnte nicht abgerufen werden.,Falha ao buscar a configuração.,Impossibile recuperare la configurazione.,설정을 가져오지 못했습니다.,获取配置失败。
MISSING_VERSION,The game version is missing from the configuration.,設定にゲームのバージョンがありません。,В конфигурации отсутствует версия игры.,La version du jeu est absente de la configuration.,Falta la versión del juego en la configuración.,Die Spielversion fehlt in der Konfiguration.,A versão do jogo está ausente da configuração.,La versione del gioco manca nella configurazione.,설정에서 게임 버전이 누락되었습니다.,配置中缺少游戏版本。
MISSING_DOWNLOAD_URL,The platform's download URL is missing from the configuration.,設定にプラットフォームのダウンロードURLがありません。,В конфигурации отсутствует URL загрузки платформы.,L'URL de téléchargement de la plateforme est absente de la configuration.,Falta la URL de descarga de la plataforma en la configuración.,Die Download-URL der Plattform fehlt in der Konfiguration.,A URL de download da plataforma está ausente da configuração.,L'URL di download della piattaforma manca nella configurazione.,설정에서 플랫폼의 다운로드 URL이 누락되었습니다.,配置中缺少平台的下载 URL。
MISSING_DOWNLOAD_EXE,The platform's download executable path is missing from the configuration.,設定にプラットフォームのダウンロード実行ファイルのパスがありません。,В конфигурации отсутствует путь к исполняемому файлу загрузки платформы.,Le chemin exécutable du téléchargement de la plateforme est absent de la configuration.,Falta la ruta del ejecutable de descarga de la plataforma en la configuración.,Der ausführbare Download-Pfad der Plattform fehlt in der Konfiguration.,O caminho do executável de download da plataforma está ausente da configuração.,Il percorso eseguibile del download della piattaforma manca nella configurazione.,설정에서 플랫폼의 다운로드 실행 파일 경로가 누락되었습니다.,配置中缺少平台的下载可执行文件路径。
FAILED_DOWNLOAD,Failed to download the game.,ゲームのダウンロードに失敗しました。,Не удалось загрузить игру.,Échec du téléchargement du jeu.,Error al descargar el juego.,Fehler beim Herunterladen des Spiels.,Falha ao baixar o jogo.,Impossibile scaricare il gioco.,게임 다운로드에 실패했습니다.,游戏下载失败。
FAILED_LAUNCH,Failed to launch the game.,ゲームの起動に失敗しました。,Не удалось запустить игру.,Échec du lancement du jeu.,Error al iniciar el juego.,Fehler beim Starten des Spiels.,Falha ao iniciar o jogo.,Impossibile avviare il gioco.,게임 실행에 실패했습니다.,游戏启动失败。